{
  "task_id": "22222222222222222222222222222222",
  "status": "done",
  "stage": "done",
  "session_id": "s_2222222222222222",
  "question": "这个月适合推进已经准备好的计划吗？",
  "answer": "条件明确后分阶段推进，并为关键节点保留复核时间。",
  "partial": false,
  "created_at": "2026-08-24T12:00:00+08:00",
  "updated_at": "2026-08-24T12:01:30+08:00",
  "completed_at": "2026-08-24T12:01:30+08:00"
}
