{
  "task_id": "11111111111111111111111111111111",
  "status": "running",
  "stage": "analysis",
  "session_id": "s_1111111111111111",
  "question": "这个月适合推进已经准备好的计划吗？",
  "answer": "先核对已有条件，再决定推进节奏。",
  "partial": true,
  "streamable": true,
  "created_at": "2026-08-24T12:00:00+08:00",
  "updated_at": "2026-08-24T12:00:10+08:00",
  "completed_at": null
}
